{
  "continuation_token": null,
  "count": 522,
  "value": [
    "2025-11-25T22:39:07.1247726Z ##[section]Starting: Unit Test",
    "2025-11-25T22:39:07.1255571Z ==============================================================================",
    "2025-11-25T22:39:07.1255934Z Task         : Azure CLI",
    "2025-11-25T22:39:07.1256118Z Description  : Run Azure CLI commands against an Azure subscription in a PowerShell Core/Shell script when running on Linux agent or PowerShell/PowerShell Core/Batch script when running on Windows agent.",
    "2025-11-25T22:39:07.1256435Z Version      : 2.264.0",
    "2025-11-25T22:39:07.1256574Z Author       : Microsoft Corporation",
    "2025-11-25T22:39:07.1256753Z Help         : https://docs.microsoft.com/azure/devops/pipelines/tasks/deploy/azure-cli",
    "2025-11-25T22:39:07.1256929Z ==============================================================================",
    "2025-11-25T22:39:07.5002609Z [command]/opt/hostedtoolcache/Python/3.8.18/x64/bin/az version",
    "2025-11-25T22:39:07.8513069Z {",
    "2025-11-25T22:39:07.8514527Z   \"azure-cli\": \"2.60.0\",",
    "2025-11-25T22:39:07.8514889Z   \"azure-cli-core\": \"2.60.0\",",
    "2025-11-25T22:39:07.8515548Z   \"azure-cli-telemetry\": \"1.1.0\",",
    "2025-11-25T22:39:07.8515962Z   \"extensions\": {",
    "2025-11-25T22:39:07.8516369Z     \"azure-devops\": \"1.0.2\"",
    "2025-11-25T22:39:07.8516681Z   }",
    "2025-11-25T22:39:07.8516995Z }",
    "2025-11-25T22:39:07.8544734Z Setting AZURE_CONFIG_DIR env variable to: /home/vsts/work/_temp/.azclitask",
    "2025-11-25T22:39:07.8552234Z Setting active cloud to: AzureCloud",
    "2025-11-25T22:39:07.8556218Z [command]/opt/hostedtoolcache/Python/3.8.18/x64/bin/az cloud set -n AzureCloud",
    "2025-11-25T22:39:08.9606240Z [command]/opt/hostedtoolcache/Python/3.8.18/x64/bin/az login --service-principal -u *** --tenant 72f988bf-86f1-41af-91ab-2d7cd011db47 --allow-no-subscriptions --federated-token ***",
    "2025-11-25T22:39:09.9088809Z [",
    "2025-11-25T22:39:09.9089645Z   {",
    "2025-11-25T22:39:09.9089882Z     \"cloudName\": \"AzureCloud\",",
    "2025-11-25T22:39:09.9090199Z     \"homeTenantId\": \"72f988bf-86f1-41af-91ab-2d7cd011db47\",",
    "2025-11-25T22:39:09.9090533Z     \"id\": \"e342c2c0-f844-4b18-9208-52c8c234c30e\",",
    "2025-11-25T22:39:09.9090876Z     \"isDefault\": true,",
    "2025-11-25T22:39:09.9091164Z     \"managedByTenants\": [",
    "2025-11-25T22:39:09.9091429Z       {",
    "2025-11-25T22:39:09.9091662Z         \"tenantId\": \"2f4a9838-26b7-47ee-be60-ccc1fdec5953\"",
    "2025-11-25T22:39:09.9091890Z       }",
    "2025-11-25T22:39:09.9092109Z     ],",
    "2025-11-25T22:39:09.9092328Z     \"name\": \"Synapse_OSS_ML_DevTest_001\",",
    "2025-11-25T22:39:09.9092584Z     \"state\": \"Enabled\",",
    "2025-11-25T22:39:09.9092827Z     \"tenantId\": \"72f988bf-86f1-41af-91ab-2d7cd011db47\",",
    "2025-11-25T22:39:09.9093083Z     \"user\": {",
    "2025-11-25T22:39:09.9093470Z       \"name\": \"***\",",
    "2025-11-25T22:39:09.9093693Z       \"type\": \"servicePrincipal\"",
    "2025-11-25T22:39:09.9093923Z     }",
    "2025-11-25T22:39:09.9094111Z   }",
    "2025-11-25T22:39:09.9094297Z ]",
    "2025-11-25T22:39:09.9095417Z [command]/opt/hostedtoolcache/Python/3.8.18/x64/bin/az account set --subscription e342c2c0-f844-4b18-9208-52c8c234c30e",
    "2025-11-25T22:39:10.5257174Z [command]/usr/bin/bash /home/vsts/work/_temp/azureclitaskscript1764110347495.sh",
    "2025-11-25T22:39:13.1213002Z [info] welcome to sbt 1.10.11 (Eclipse Adoptium Java 17.0.17)",
    "2025-11-25T22:39:14.8691064Z [info] loading settings for project s-build from assembly.sbt, build.sbt, plugins.sbt...",
    "2025-11-25T22:39:15.6450550Z [info] loading project definition from /home/vsts/work/1/s/project",
    "2025-11-25T22:39:18.2721000Z [info] loading settings for project root from build.sbt, sonatype.sbt...",
    "2025-11-25T22:39:19.2561504Z [warn] Secret pgp-pw not downloaded. Set SYNAPSEML_ENABLE_PUBLISH=true to enable publishing.",
    "2025-11-25T22:39:19.2576080Z [warn] Secret pgp-private not downloaded. Set SYNAPSEML_ENABLE_PUBLISH=true to enable publishing.",
    "2025-11-25T22:39:19.2576713Z [warn] Secret pgp-public not downloaded. Set SYNAPSEML_ENABLE_PUBLISH=true to enable publishing.",
    "2025-11-25T22:39:20.1473628Z [info] set current project to synapseml (in build file:/home/vsts/work/1/s/)",
    "2025-11-25T22:39:20.5669898Z [warn] Secret nexus-un not downloaded. Set SYNAPSEML_ENABLE_PUBLISH=true to enable publishing.",
    "2025-11-25T22:39:20.5671649Z [warn] Secret nexus-pw not downloaded. Set SYNAPSEML_ENABLE_PUBLISH=true to enable publishing.",
    "2025-11-25T22:39:20.5673047Z [warn] Secret ado-feed-token not downloaded. Set SYNAPSEML_ENABLE_PUBLISH=true to enable publishing.",
    "2025-11-25T22:39:28.7562788Z [info] Passed: Total 0, Failed 0, Errors 0, Passed 0",
    "2025-11-25T22:39:28.7571872Z [info] No tests to run for core / Test / testOnly",
    "2025-11-25T22:39:29.0760408Z [info] Passed: Total 0, Failed 0, Errors 0, Passed 0",
    "2025-11-25T22:39:29.0761899Z [info] No tests to run for cognitive / Test / testOnly",
    "2025-11-25T22:39:29.0762361Z [info] Passed: Total 0, Failed 0, Errors 0, Passed 0",
    "2025-11-25T22:39:29.0762776Z [info] No tests to run for vw / Test / testOnly",
    "2025-11-25T22:39:29.0824944Z [info] Passed: Total 0, Failed 0, Errors 0, Passed 0",
    "2025-11-25T22:39:29.0827653Z [info] No tests to run for lightgbm / Test / testOnly",
    "2025-11-25T22:39:30.7246848Z [info] UnrollBinaryImageSuite:",
    "2025-11-25T22:39:31.4890963Z Using Spark's default log4j profile: org/apache/spark/log4j2-defaults.properties",
    "2025-11-25T22:39:31.5186763Z 25/11/25 22:39:31 INFO UnrollBinaryImage: {\"protocolVersion\":\"0.0.1\",\"method\":\"constructor\",\"libraryName\":\"SynapseML\",\"className\":\"class com.microsoft.azure.synapse.ml.image.UnrollBinaryImage\",\"libraryVersion\":\"1.1.0-27-0d303b21-SNAPSHOT\",\"modelUid\":\"UnrollImage_96e5b53e43a9\"}",
    "2025-11-25T22:39:32.9565491Z 25/11/25 22:39:32 INFO SparkContext: Running Spark version 4.0.1",
    "2025-11-25T22:39:32.9579453Z 25/11/25 22:39:32 INFO SparkContext: OS info Linux, 6.8.0-1041-azure, amd64",
    "2025-11-25T22:39:32.9585889Z 25/11/25 22:39:32 INFO SparkContext: Java version 17.0.17",
    "2025-11-25T22:39:33.1734588Z 25/11/25 22:39:33 WARN NativeCodeLoader: Unable to load native-hadoop library for your platform... using builtin-java classes where applicable",
    "2025-11-25T22:39:33.2484230Z 25/11/25 22:39:33 INFO ResourceUtils: ==============================================================",
    "2025-11-25T22:39:33.2486067Z 25/11/25 22:39:33 INFO ResourceUtils: No custom resources configured for spark.driver.",
    "2025-11-25T22:39:33.2509840Z 25/11/25 22:39:33 INFO ResourceUtils: ==============================================================",
    "2025-11-25T22:39:33.2536467Z 25/11/25 22:39:33 INFO SparkContext: Submitted application: com.microsoft.azure.synapse.ml.core.test.base.TestBase$@6babf65c",
    "2025-11-25T22:39:33.2593470Z 25/11/25 22:39:33 INFO SparkContext: Spark configuration:",
    "2025-11-25T22:39:33.2596893Z spark.app.name=com.microsoft.azure.synapse.ml.core.test.base.TestBase$@6babf65c",
    "2025-11-25T22:39:33.2615868Z spark.app.startTime=1764110372949",
    "2025-11-25T22:39:33.2620547Z spark.driver.extraJavaOptions=-Djava.net.preferIPv6Addresses=false -XX:+IgnoreUnrecognizedVMOptions --add-modules=jdk.incubator.vector --add-opens=java.base/java.lang=ALL-UNNAMED --add-opens=java.base/java.lang.invoke=ALL-UNNAMED --add-opens=java.base/java.lang.reflect=ALL-UNNAMED --add-opens=java.base/java.io=ALL-UNNAMED --add-opens=java.base/java.net=ALL-UNNAMED --add-opens=java.base/java.nio=ALL-UNNAMED --add-opens=java.base/java.util=ALL-UNNAMED --add-opens=java.base/java.util.concurrent=ALL-UNNAMED --add-opens=java.base/java.util.concurrent.atomic=ALL-UNNAMED --add-opens=java.base/jdk.internal.ref=ALL-UNNAMED --add-opens=java.base/sun.nio.ch=ALL-UNNAMED --add-opens=java.base/sun.nio.cs=ALL-UNNAMED --add-opens=java.base/sun.security.action=ALL-UNNAMED --add-opens=java.base/sun.util.calendar=ALL-UNNAMED --add-opens=java.security.jgss/sun.security.krb5=ALL-UNNAMED -Djdk.reflect.useDirectMethodHandle=false -Dio.netty.tryReflectionSetAccessible=true",
    "2025-11-25T22:39:33.2621680Z spark.driver.maxResultSize=6g",
    "2025-11-25T22:39:33.2622705Z spark.executor.extraJavaOptions=-Djava.net.preferIPv6Addresses=false -XX:+IgnoreUnrecognizedVMOptions --add-modules=jdk.incubator.vector --add-opens=java.base/java.lang=ALL-UNNAMED --add-opens=java.base/java.lang.invoke=ALL-UNNAMED --add-opens=java.base/java.lang.reflect=ALL-UNNAMED --add-opens=java.base/java.io=ALL-UNNAMED --add-opens=java.base/java.net=ALL-UNNAMED --add-opens=java.base/java.nio=ALL-UNNAMED --add-opens=java.base/java.util=ALL-UNNAMED --add-opens=java.base/java.util.concurrent=ALL-UNNAMED --add-opens=java.base/java.util.concurrent.atomic=ALL-UNNAMED --add-opens=java.base/jdk.internal.ref=ALL-UNNAMED --add-opens=java.base/sun.nio.ch=ALL-UNNAMED --add-opens=java.base/sun.nio.cs=ALL-UNNAMED --add-opens=java.base/sun.security.action=ALL-UNNAMED --add-opens=java.base/sun.util.calendar=ALL-UNNAMED --add-opens=java.security.jgss/sun.security.krb5=ALL-UNNAMED -Djdk.reflect.useDirectMethodHandle=false -Dio.netty.tryReflectionSetAccessible=true",
    "2025-11-25T22:39:33.2624216Z spark.hadoop.fs.s3a.vectored.read.max.merged.size=2M",
    "2025-11-25T22:39:33.2624530Z spark.hadoop.fs.s3a.vectored.read.min.seek.size=128K",
    "2025-11-25T22:39:33.2624783Z spark.logConf=true",
    "2025-11-25T22:39:33.2625020Z spark.master=local[*]",
    "2025-11-25T22:39:33.2625775Z spark.sql.crossJoin.enabled=true",
    "2025-11-25T22:39:33.2626053Z spark.sql.shuffle.partitions=20",
    "2025-11-25T22:39:33.2626323Z spark.sql.warehouse.dir=file:/home/vsts/work/1/s/opencv/spark-warehouse",
    "2025-11-25T22:39:33.2888202Z 25/11/25 22:39:33 INFO ResourceProfile: Default ResourceProfile created, executor resources: Map(cores -> name: cores, amount: 1, script: , vendor: , memory -> name: memory, amount: 1024, script: , vendor: , offHeap -> name: offHeap, amount: 0, script: , vendor: ), task resources: Map(cpus -> name: cpus, amount: 1.0)",
    "2025-11-25T22:39:33.2919991Z 25/11/25 22:39:33 INFO ResourceProfile: Limiting resource is cpu",
    "2025-11-25T22:39:33.2938042Z 25/11/25 22:39:33 INFO ResourceProfileManager: Added ResourceProfile id: 0",
    "2025-11-25T22:39:33.3716718Z 25/11/25 22:39:33 INFO SecurityManager: Changing view acls to: vsts",
    "2025-11-25T22:39:33.3727525Z 25/11/25 22:39:33 INFO SecurityManager: Changing modify acls to: vsts",
    "2025-11-25T22:39:33.3728764Z 25/11/25 22:39:33 INFO SecurityManager: Changing view acls groups to: vsts",
    "2025-11-25T22:39:33.3729448Z 25/11/25 22:39:33 INFO SecurityManager: Changing modify acls groups to: vsts",
    "2025-11-25T22:39:33.3745590Z 25/11/25 22:39:33 INFO SecurityManager: SecurityManager: authentication disabled; ui acls disabled; users with view permissions: vsts groups with view permissions: EMPTY; users with modify permissions: vsts; groups with modify permissions: EMPTY; RPC SSL disabled",
    "2025-11-25T22:39:33.6840871Z 25/11/25 22:39:33 INFO Utils: Successfully started service 'sparkDriver' on port 39621.",
    "2025-11-25T22:39:33.7108942Z 25/11/25 22:39:33 INFO SparkEnv: Registering MapOutputTracker",
    "2025-11-25T22:39:33.7280656Z 25/11/25 22:39:33 INFO SparkEnv: Registering BlockManagerMaster",
    "2025-11-25T22:39:33.7423033Z 25/11/25 22:39:33 INFO BlockManagerMasterEndpoint: Using org.apache.spark.storage.DefaultTopologyMapper for getting topology information",
    "2025-11-25T22:39:33.7445763Z 25/11/25 22:39:33 INFO BlockManagerMasterEndpoint: BlockManagerMasterEndpoint up",
    "2025-11-25T22:39:33.7473362Z 25/11/25 22:39:33 INFO SparkEnv: Registering BlockManagerMasterHeartbeat",
    "2025-11-25T22:39:33.7726575Z 25/11/25 22:39:33 INFO DiskBlockManager: Created local directory at /tmp/blockmgr-fd0dea37-70b7-4c6f-972e-d9d8a14155c1",
    "2025-11-25T22:39:33.8144748Z 25/11/25 22:39:33 INFO SparkEnv: Registering OutputCommitCoordinator",
    "2025-11-25T22:39:33.9542656Z 25/11/25 22:39:33 INFO JettyUtils: Start Jetty 0.0.0.0:4040 for SparkUI",
    "2025-11-25T22:39:34.0427867Z 25/11/25 22:39:34 INFO Utils: Successfully started service 'SparkUI' on port 4040.",
    "2025-11-25T22:39:34.1158443Z 25/11/25 22:39:34 INFO SecurityManager: Changing view acls to: vsts",
    "2025-11-25T22:39:34.1171091Z 25/11/25 22:39:34 INFO SecurityManager: Changing modify acls to: vsts",
    "2025-11-25T22:39:34.1172112Z 25/11/25 22:39:34 INFO SecurityManager: Changing view acls groups to: vsts",
    "2025-11-25T22:39:34.1178592Z 25/11/25 22:39:34 INFO SecurityManager: Changing modify acls groups to: vsts",
    "2025-11-25T22:39:34.1185890Z 25/11/25 22:39:34 INFO SecurityManager: SecurityManager: authentication disabled; ui acls disabled; users with view permissions: vsts groups with view permissions: EMPTY; users with modify permissions: vsts; groups with modify permissions: EMPTY; RPC SSL disabled",
    "2025-11-25T22:39:34.2656548Z 25/11/25 22:39:34 INFO Executor: Starting executor ID driver on host runnervmr8kkp.gj0w5etaotquvaucz2ki3xopba.bx.internal.cloudapp.net",
    "2025-11-25T22:39:34.2692472Z 25/11/25 22:39:34 INFO Executor: OS info Linux, 6.8.0-1041-azure, amd64",
    "2025-11-25T22:39:34.2693603Z 25/11/25 22:39:34 INFO Executor: Java version 17.0.17",
    "2025-11-25T22:39:34.3104540Z 25/11/25 22:39:34 INFO Executor: Starting executor with user classpath (userClassPathFirst = false): ''",
    "2025-11-25T22:39:34.3176219Z 25/11/25 22:39:34 INFO Executor: Created or updated repl class loader org.apache.spark.util.MutableURLClassLoader@448af804 for default.",
    "2025-11-25T22:39:34.3750325Z 25/11/25 22:39:34 INFO Utils: Successfully started service 'org.apache.spark.network.netty.NettyBlockTransferService' on port 42085.",
    "2025-11-25T22:39:34.3869309Z 25/11/25 22:39:34 INFO NettyBlockTransferService: Server created on runnervmr8kkp.gj0w5etaotquvaucz2ki3xopba.bx.internal.cloudapp.net:42085",
    "2025-11-25T22:39:34.3949902Z 25/11/25 22:39:34 INFO BlockManager: Using org.apache.spark.storage.RandomBlockReplicationPolicy for block replication policy",
    "2025-11-25T22:39:34.4096808Z 25/11/25 22:39:34 INFO BlockManagerMaster: Registering BlockManager BlockManagerId(driver, runnervmr8kkp.gj0w5etaotquvaucz2ki3xopba.bx.internal.cloudapp.net, 42085, None)",
    "2025-11-25T22:39:34.4183692Z 25/11/25 22:39:34 INFO BlockManagerMasterEndpoint: Registering block manager runnervmr8kkp.gj0w5etaotquvaucz2ki3xopba.bx.internal.cloudapp.net:42085 with 861.6 MiB RAM, BlockManagerId(driver, runnervmr8kkp.gj0w5etaotquvaucz2ki3xopba.bx.internal.cloudapp.net, 42085, None)",
    "2025-11-25T22:39:34.4209672Z 25/11/25 22:39:34 INFO BlockManagerMaster: Registered BlockManager BlockManagerId(driver, runnervmr8kkp.gj0w5etaotquvaucz2ki3xopba.bx.internal.cloudapp.net, 42085, None)",
    "2025-11-25T22:39:34.4220807Z 25/11/25 22:39:34 INFO BlockManager: Initialized BlockManager: BlockManagerId(driver, runnervmr8kkp.gj0w5etaotquvaucz2ki3xopba.bx.internal.cloudapp.net, 42085, None)",
    "2025-11-25T22:39:41.8218926Z [info] - Serialization Fuzzing",
    "2025-11-25T22:39:41.8403228Z [info] + Test Serialization Fuzzing took 11.02s ",
    "2025-11-25T22:39:41.8545811Z [info] - Experiment Fuzzing",
    "2025-11-25T22:39:41.8676364Z [info] + Test Experiment Fuzzing took 0.016s ",
    "2025-11-25T22:39:41.8749912Z Testing parameter height",
    "2025-11-25T22:39:41.8967525Z Testing parameter inputCol",
    "2025-11-25T22:39:41.8987406Z Testing parameter nChannels",
    "2025-11-25T22:39:41.8995346Z Testing parameter outputCol",
    "2025-11-25T22:39:41.8998490Z Testing parameter width",
    "2025-11-25T22:39:41.9021160Z [info] - Getters and Setters work as anticipated",
    "2025-11-25T22:39:41.9030598Z [info] + Test Getters and Setters work as anticipated took 0.034s ",
    "2025-11-25T22:39:42.7578448Z [info] - unroll did not change",
    "2025-11-25T22:39:42.7637333Z [info] + Test unroll did not change took 0.857s ",
    "2025-11-25T22:39:42.7772286Z Alert Provided - Suite UnrollBinaryImageSuite took 11.927s",
    "2025-11-25T22:39:42.8906400Z [info] ImageTransformerSuite:",
    "2025-11-25T22:39:43.8614774Z [info] - Serialization Fuzzing",
    "2025-11-25T22:39:43.8625931Z [info] + Test Serialization Fuzzing took 1.056s ",
    "2025-11-25T22:39:43.9192528Z [info] - Experiment Fuzzing",
    "2025-11-25T22:39:43.9193282Z [info] + Test Experiment Fuzzing took 0.051s ",
    "2025-11-25T22:39:43.9235651Z Testing parameter autoConvertToColor",
    "2025-11-25T22:39:43.9236411Z Testing parameter colorScaleFactor",
    "2025-11-25T22:39:43.9278550Z Testing parameter ignoreDecodingErrors",
    "2025-11-25T22:39:43.9279291Z Testing parameter inputCol",
    "2025-11-25T22:39:43.9279670Z Testing parameter normalizeMean",
    "2025-11-25T22:39:43.9280008Z Testing parameter normalizeStd",
    "2025-11-25T22:39:43.9280341Z Testing parameter outputCol",
    "2025-11-25T22:39:43.9280694Z Testing parameter stages",
    "2025-11-25T22:39:43.9281018Z Could not test parameter stages",
    "2025-11-25T22:39:43.9281355Z Testing parameter tensorChannelOrder",
    "2025-11-25T22:39:43.9281723Z Testing parameter tensorElementType",
    "2025-11-25T22:39:43.9282051Z Testing parameter toTensor",
    "2025-11-25T22:39:43.9359935Z [info] - Getters and Setters work as anticipated",
    "2025-11-25T22:39:43.9361890Z [info] + Test Getters and Setters work as anticipated took 0.017s ",
    "2025-11-25T22:39:44.6576305Z OpenJDK 64-Bit Server VM warning: You have loaded library /tmp/mml-natives1838915176954288015/libopencv_java320.so which might have disabled stack guard. The VM will try to fix the stack guard now.",
    "2025-11-25T22:39:44.6577650Z It's highly recommended that you fix the library with 'execstack -c <libfile>', or link it with '-z noexecstack'.",
    "2025-11-25T22:39:45.1104231Z [info] - general workflow",
    "2025-11-25T22:39:45.1146185Z [info] + Test general workflow took 1.179s ",
    "2025-11-25T22:39:45.8441523Z [info] - binary file input *** FAILED ***",
    "2025-11-25T22:39:45.8443452Z [info]   1 did not equal 31 (ImageTransformerSuite.scala:210)",
    "2025-11-25T22:39:45.8567503Z [info] + Test binary file input took 0.74s ",
    "2025-11-25T22:39:46.0571508Z [info] - binary file input 2 *** FAILED ***",
    "2025-11-25T22:39:46.0573174Z [info]   1 did not equal 31 (ImageTransformerSuite.scala:234)",
    "2025-11-25T22:39:46.0573975Z [info] + Test binary file input 2 took 0.197s ",
    "2025-11-25T22:39:46.3689569Z [info] - crop",
    "2025-11-25T22:39:46.3718786Z [info] + Test crop took 0.311s ",
    "2025-11-25T22:39:46.8052347Z [info] - color format *** FAILED ***",
    "2025-11-25T22:39:46.8056541Z [info]   java.util.NoSuchElementException: head of empty array",
    "2025-11-25T22:39:46.8059739Z [info]   at scala.collection.ArrayOps$.head$extension(ArrayOps.scala:233)",
    "2025-11-25T22:39:46.8062417Z [info]   at org.apache.spark.sql.Dataset.head(Dataset.scala:2679)",
    "2025-11-25T22:39:46.8065191Z [info]   at com.microsoft.azure.synapse.ml.opencv.OpenCVTestUtils.selectTestImageBytes(ImageTransformerSuite.scala:31)",
    "2025-11-25T22:39:46.8067926Z [info]   at com.microsoft.azure.synapse.ml.opencv.OpenCVTestUtils.selectTestImageBytes$(ImageTransformerSuite.scala:30)",
    "2025-11-25T22:39:46.8070640Z [info]   at com.microsoft.azure.synapse.ml.opencv.ImageTransformerSuite.selectTestImageBytes(ImageTransformerSuite.scala:164)",
    "2025-11-25T22:39:46.8073400Z [info]   at com.microsoft.azure.synapse.ml.opencv.ImageTransformerSuite.$anonfun$new$21(ImageTransformerSuite.scala:284)",
    "2025-11-25T22:39:46.8076288Z [info]   at scala.runtime.java8.JFunction0$mcV$sp.apply(JFunction0$mcV$sp.scala:18)",
    "2025-11-25T22:39:46.8079172Z [info]   at org.scalatest.OutcomeOf.outcomeOf(OutcomeOf.scala:85)",
    "2025-11-25T22:39:46.8079858Z [info]   at org.scalatest.OutcomeOf.outcomeOf$(OutcomeOf.scala:83)",
    "2025-11-25T22:39:46.8081751Z [info]   at org.scalatest.OutcomeOf$.outcomeOf(OutcomeOf.scala:104)",
    "2025-11-25T22:39:46.8082268Z [info]   ...",
    "2025-11-25T22:39:46.8082809Z [info] + Test color format took 0.432s ",
    "2025-11-25T22:39:47.0059816Z [info] - verify blur *** FAILED ***",
    "2025-11-25T22:39:47.0063537Z [info]   java.util.NoSuchElementException: head of empty array",
    "2025-11-25T22:39:47.0066327Z [info]   at scala.collection.ArrayOps$.head$extension(ArrayOps.scala:233)",
    "2025-11-25T22:39:47.0068958Z [info]   at org.apache.spark.sql.Dataset.head(Dataset.scala:2679)",
    "2025-11-25T22:39:47.0071566Z [info]   at com.microsoft.azure.synapse.ml.opencv.OpenCVTestUtils.selectTestImageBytes(ImageTransformerSuite.scala:31)",
    "2025-11-25T22:39:47.0074292Z [info]   at com.microsoft.azure.synapse.ml.opencv.OpenCVTestUtils.selectTestImageBytes$(ImageTransformerSuite.scala:30)",
    "2025-11-25T22:39:47.0077053Z [info]   at com.microsoft.azure.synapse.ml.opencv.ImageTransformerSuite.selectTestImageBytes(ImageTransformerSuite.scala:164)",
    "2025-11-25T22:39:47.0079741Z [info]   at com.microsoft.azure.synapse.ml.opencv.ImageTransformerSuite.$anonfun$new$23(ImageTransformerSuite.scala:303)",
    "2025-11-25T22:39:47.0082391Z [info]   at scala.runtime.java8.JFunction0$mcV$sp.apply(JFunction0$mcV$sp.scala:18)",
    "2025-11-25T22:39:47.0084972Z [info]   at org.scalatest.OutcomeOf.outcomeOf(OutcomeOf.scala:85)",
    "2025-11-25T22:39:47.0087653Z [info]   at org.scalatest.OutcomeOf.outcomeOf$(OutcomeOf.scala:83)",
    "2025-11-25T22:39:47.0090931Z [info]   at org.scalatest.OutcomeOf$.outcomeOf(OutcomeOf.scala:104)",
    "2025-11-25T22:39:47.0092589Z [info]   ...",
    "2025-11-25T22:39:47.0095730Z [info] + Test verify blur took 0.196s ",
    "2025-11-25T22:39:47.3890370Z [info] - verify thresholding",
    "2025-11-25T22:39:47.3900842Z [info] + Test verify thresholding took 0.384s ",
    "2025-11-25T22:39:47.5740000Z [info] - verify application of gaussian kernel (has blur effect) *** FAILED ***",
    "2025-11-25T22:39:47.5777960Z [info]   java.util.NoSuchElementException: head of empty array",
    "2025-11-25T22:39:47.5779680Z [info]   at scala.collection.ArrayOps$.head$extension(ArrayOps.scala:233)",
    "2025-11-25T22:39:47.5780339Z [info]   at org.apache.spark.sql.Dataset.head(Dataset.scala:2679)",
    "2025-11-25T22:39:47.5781058Z [info]   at com.microsoft.azure.synapse.ml.opencv.OpenCVTestUtils.selectTestImageBytes(ImageTransformerSuite.scala:31)",
    "2025-11-25T22:39:47.5781730Z [info]   at com.microsoft.azure.synapse.ml.opencv.OpenCVTestUtils.selectTestImageBytes$(ImageTransformerSuite.scala:30)",
    "2025-11-25T22:39:47.5782406Z [info]   at com.microsoft.azure.synapse.ml.opencv.ImageTransformerSuite.selectTestImageBytes(ImageTransformerSuite.scala:164)",
    "2025-11-25T22:39:47.5783060Z [info]   at com.microsoft.azure.synapse.ml.opencv.ImageTransformerSuite.$anonfun$new$28(ImageTransformerSuite.scala:341)",
    "2025-11-25T22:39:47.5783678Z [info]   at scala.runtime.java8.JFunction0$mcV$sp.apply(JFunction0$mcV$sp.scala:18)",
    "2025-11-25T22:39:47.5784217Z [info]   at org.scalatest.OutcomeOf.outcomeOf(OutcomeOf.scala:85)",
    "2025-11-25T22:39:47.5785333Z [info]   at org.scalatest.OutcomeOf.outcomeOf$(OutcomeOf.scala:83)",
    "2025-11-25T22:39:47.5785913Z [info]   at org.scalatest.OutcomeOf$.outcomeOf(OutcomeOf.scala:104)",
    "2025-11-25T22:39:47.5786391Z [info]   ...",
    "2025-11-25T22:39:47.5794855Z [info] + Test verify application of gaussian kernel (has blur effect) took 0.184s ",
    "2025-11-25T22:39:48.3894431Z [info] - verify ignore decoding error *** FAILED ***",
    "2025-11-25T22:39:48.3915317Z [info]   1 did not equal 0 (ImageTransformerSuite.scala:359)",
    "2025-11-25T22:39:48.3916768Z [info] + Test verify ignore decoding error took 0.81s ",
    "2025-11-25T22:39:49.8884722Z [info] - image transformer can convert a 3-channel image to tensor",
    "2025-11-25T22:39:49.8886157Z [info] + Test image transformer can convert a 3-channel image to tensor took 0.889s ",
    "2025-11-25T22:39:49.8886589Z [info] - image transformer can convert a 4-channel image to tensor",
    "2025-11-25T22:39:49.8887019Z [info] + Test image transformer can convert a 4-channel image to tensor took 0.417s ",
    "2025-11-25T22:39:50.1186914Z [info] - image transformer can convert a single-channel (grayscale) image to tensor",
    "2025-11-25T22:39:50.1238683Z [info] + Test image transformer can convert a single-channel (grayscale) image to tensor took 0.422s ",
    "2025-11-25T22:39:50.1247549Z Info Provided - Suite ImageTransformerSuite took 7.285s",
    "2025-11-25T22:39:50.1923279Z [info] ImageSetAugmenterSuite:",
    "2025-11-25T22:39:55.2894449Z [info] - Serialization Fuzzing",
    "2025-11-25T22:39:55.2895409Z [info] + Test Serialization Fuzzing took 5.132s ",
    "2025-11-25T22:39:55.3248491Z [info] - Experiment Fuzzing",
    "2025-11-25T22:39:55.3296595Z [info] + Test Experiment Fuzzing took 0.038s ",
    "2025-11-25T22:39:55.3297478Z Testing parameter flipLeftRight",
    "2025-11-25T22:39:55.3297842Z Testing parameter flipUpDown",
    "2025-11-25T22:39:55.3298170Z Testing parameter inputCol",
    "2025-11-25T22:39:55.3298488Z Testing parameter outputCol",
    "2025-11-25T22:39:55.3298854Z [info] - Getters and Setters work as anticipated",
    "2025-11-25T22:39:55.3299223Z [info] + Test Getters and Setters work as anticipated took 0.003s ",
    "2025-11-25T22:39:56.0108701Z [info] - An augmenter should be abe to flip images",
    "2025-11-25T22:39:56.0146730Z [info] + Test An augmenter should be abe to flip images took 0.684s ",
    "2025-11-25T22:39:56.0147689Z Info Provided - Suite ImageSetAugmenterSuite took 5.857s",
    "2025-11-25T22:39:56.0259607Z [info] UnrollImageSuite:",
    "2025-11-25T22:39:57.1892723Z [info] - Serialization Fuzzing",
    "2025-11-25T22:39:57.1906172Z [info] + Test Serialization Fuzzing took 1.169s ",
    "2025-11-25T22:39:57.2011710Z [info] - Experiment Fuzzing",
    "2025-11-25T22:39:57.2015321Z [info] + Test Experiment Fuzzing took 0.009s ",
    "2025-11-25T22:39:57.2015625Z Testing parameter inputCol",
    "2025-11-25T22:39:57.2016300Z Testing parameter outputCol",
    "2025-11-25T22:39:57.2040186Z [info] - Getters and Setters work as anticipated",
    "2025-11-25T22:39:57.2041119Z [info] + Test Getters and Setters work as anticipated took 0.001s ",
    "2025-11-25T22:39:57.3100465Z [info] - roll and unroll",
    "2025-11-25T22:39:57.3101208Z [info] + Test roll and unroll took 0.107s ",
    "2025-11-25T22:39:57.8953957Z Info Provided - Suite UnrollImageSuite took 1.557s",
    "2025-11-25T22:39:57.8954806Z [info] - unroll",
    "2025-11-25T22:39:57.8956239Z [info] + Test unroll took 0.271s ",
    "2025-11-25T22:39:57.8956696Z [info] Run completed in 28 seconds, 533 milliseconds.",
    "2025-11-25T22:39:57.8957081Z [info] Total number of tests run: 28",
    "2025-11-25T22:39:57.8957412Z [info] Suites: completed 4, aborted 0",
    "2025-11-25T22:39:57.8957801Z [info] Tests: succeeded 22, failed 6, canceled 0, ignored 0, pending 0",
    "2025-11-25T22:39:57.8958156Z [info] *** 6 TESTS FAILED ***",
    "2025-11-25T22:39:57.8958468Z [error] Failed tests:",
    "2025-11-25T22:39:57.8958864Z [error] \tcom.microsoft.azure.synapse.ml.opencv.ImageTransformerSuite",
    "2025-11-25T22:39:57.8959264Z [info] Passed: Total 0, Failed 0, Errors 0, Passed 0",
    "2025-11-25T22:39:57.8959643Z [info] No tests to run for deepLearning / Test / testOnly",
    "2025-11-25T22:39:57.8960002Z [info] Passed: Total 0, Failed 0, Errors 0, Passed 0",
    "2025-11-25T22:39:57.8960546Z [info] No tests to run for Test / testOnly",
    "2025-11-25T22:39:57.9266019Z [error] (opencv / Test / testOnly) sbt.TestsFailedException: Tests unsuccessful",
    "2025-11-25T22:39:57.9365403Z [error] Total time: 37 s, completed Nov 25, 2025, 10:39:57 PM",
    "2025-11-25T22:39:58.3448131Z ",
    "2025-11-25T22:39:58.3476806Z ##[error]Script failed with exit code: 1",
    "2025-11-25T22:39:58.3496029Z [command]/opt/hostedtoolcache/Python/3.8.18/x64/bin/az account clear",
    "2025-11-25T22:39:59.8963677Z ##[warning]RetryHelper encountered task failure, will retry (attempt #: 1 out of 1) after 1000 ms",
    "2025-11-25T22:40:02.8972709Z [command]/opt/hostedtoolcache/Python/3.8.18/x64/bin/az version",
    "2025-11-25T22:40:02.8982752Z {",
    "2025-11-25T22:40:02.8983363Z   \"azure-cli\": \"2.60.0\",",
    "2025-11-25T22:40:02.8983746Z   \"azure-cli-core\": \"2.60.0\",",
    "2025-11-25T22:40:02.8984085Z   \"azure-cli-telemetry\": \"1.1.0\",",
    "2025-11-25T22:40:02.8984912Z   \"extensions\": {",
    "2025-11-25T22:40:02.8985389Z     \"azure-devops\": \"1.0.2\"",
    "2025-11-25T22:40:02.8985751Z   }",
    "2025-11-25T22:40:02.8985981Z }",
    "2025-11-25T22:40:02.8986346Z Setting AZURE_CONFIG_DIR env variable to: /home/vsts/work/_temp/.azclitask",
    "2025-11-25T22:40:02.8987031Z Setting active cloud to: AzureCloud",
    "2025-11-25T22:40:02.8987497Z [command]/opt/hostedtoolcache/Python/3.8.18/x64/bin/az cloud set -n AzureCloud",
    "2025-11-25T22:40:02.8992178Z [command]/opt/hostedtoolcache/Python/3.8.18/x64/bin/az login --service-principal -u *** --tenant 72f988bf-86f1-41af-91ab-2d7cd011db47 --allow-no-subscriptions --federated-token ***",
    "2025-11-25T22:40:03.3348684Z [",
    "2025-11-25T22:40:03.3349503Z   {",
    "2025-11-25T22:40:03.3361816Z     \"cloudName\": \"AzureCloud\",",
    "2025-11-25T22:40:03.3363012Z     \"homeTenantId\": \"72f988bf-86f1-41af-91ab-2d7cd011db47\",",
    "2025-11-25T22:40:03.3363622Z     \"id\": \"e342c2c0-f844-4b18-9208-52c8c234c30e\",",
    "2025-11-25T22:40:03.3363884Z     \"isDefault\": true,",
    "2025-11-25T22:40:03.3364109Z     \"managedByTenants\": [",
    "2025-11-25T22:40:03.3364339Z       {",
    "2025-11-25T22:40:03.3364572Z         \"tenantId\": \"2f4a9838-26b7-47ee-be60-ccc1fdec5953\"",
    "2025-11-25T22:40:03.3364814Z       }",
    "2025-11-25T22:40:03.3364998Z     ],",
    "2025-11-25T22:40:03.3365411Z     \"name\": \"Synapse_OSS_ML_DevTest_001\",",
    "2025-11-25T22:40:03.3365643Z     \"state\": \"Enabled\",",
    "2025-11-25T22:40:03.3365891Z     \"tenantId\": \"72f988bf-86f1-41af-91ab-2d7cd011db47\",",
    "2025-11-25T22:40:03.3366159Z     \"user\": {",
    "2025-11-25T22:40:03.3366566Z       \"name\": \"***\",",
    "2025-11-25T22:40:03.3366823Z       \"type\": \"servicePrincipal\"",
    "2025-11-25T22:40:03.3367046Z     }",
    "2025-11-25T22:40:03.3367227Z   }",
    "2025-11-25T22:40:03.3367407Z ]",
    "2025-11-25T22:40:03.3367808Z [command]/opt/hostedtoolcache/Python/3.8.18/x64/bin/az account set --subscription e342c2c0-f844-4b18-9208-52c8c234c30e",
    "2025-11-25T22:40:03.9718440Z [command]/usr/bin/bash /home/vsts/work/_temp/azureclitaskscript1764110401154.sh",
    "2025-11-25T22:40:06.6752949Z [info] welcome to sbt 1.10.11 (Eclipse Adoptium Java 17.0.17)",
    "2025-11-25T22:40:08.0080163Z [info] loading settings for project s-build from assembly.sbt, build.sbt, plugins.sbt...",
    "2025-11-25T22:40:09.4027760Z [info] loading project definition from /home/vsts/work/1/s/project",
    "2025-11-25T22:40:11.8217630Z [info] loading settings for project root from build.sbt, sonatype.sbt...",
    "2025-11-25T22:40:12.9091407Z [warn] Secret pgp-private not downloaded. Set SYNAPSEML_ENABLE_PUBLISH=true to enable publishing.",
    "2025-11-25T22:40:12.9109361Z [warn] Secret pgp-public not downloaded. Set SYNAPSEML_ENABLE_PUBLISH=true to enable publishing.",
    "2025-11-25T22:40:12.9110582Z [warn] Secret pgp-pw not downloaded. Set SYNAPSEML_ENABLE_PUBLISH=true to enable publishing.",
    "2025-11-25T22:40:13.8847286Z [info] set current project to synapseml (in build file:/home/vsts/work/1/s/)",
    "2025-11-25T22:40:14.3326104Z [warn] Secret nexus-un not downloaded. Set SYNAPSEML_ENABLE_PUBLISH=true to enable publishing.",
    "2025-11-25T22:40:14.3329821Z [warn] Secret ado-feed-token not downloaded. Set SYNAPSEML_ENABLE_PUBLISH=true to enable publishing.",
    "2025-11-25T22:40:14.3337391Z [warn] Secret nexus-pw not downloaded. Set SYNAPSEML_ENABLE_PUBLISH=true to enable publishing.",
    "2025-11-25T22:40:22.0520519Z [info] Passed: Total 0, Failed 0, Errors 0, Passed 0",
    "2025-11-25T22:40:22.0525789Z [info] No tests to run for core / Test / testOnly",
    "2025-11-25T22:40:22.3572475Z [info] Passed: Total 0, Failed 0, Errors 0, Passed 0",
    "2025-11-25T22:40:22.3578106Z [info] No tests to run for lightgbm / Test / testOnly",
    "2025-11-25T22:40:22.3579099Z [info] Passed: Total 0, Failed 0, Errors 0, Passed 0",
    "2025-11-25T22:40:22.3579967Z [info] No tests to run for cognitive / Test / testOnly",
    "2025-11-25T22:40:22.3599052Z [info] Passed: Total 0, Failed 0, Errors 0, Passed 0",
    "2025-11-25T22:40:22.3599796Z [info] No tests to run for vw / Test / testOnly",
    "2025-11-25T22:40:24.4109025Z [info] UnrollBinaryImageSuite:",
    "2025-11-25T22:40:25.4110303Z Using Spark's default log4j profile: org/apache/spark/log4j2-defaults.properties",
    "2025-11-25T22:40:25.4115674Z 25/11/25 22:40:24 INFO UnrollBinaryImage: {\"protocolVersion\":\"0.0.1\",\"method\":\"constructor\",\"libraryName\":\"SynapseML\",\"className\":\"class com.microsoft.azure.synapse.ml.image.UnrollBinaryImage\",\"libraryVersion\":\"1.1.0-27-0d303b21-SNAPSHOT\",\"modelUid\":\"UnrollImage_77d99d72808e\"}",
    "2025-11-25T22:40:26.9114448Z 25/11/25 22:40:26 INFO SparkContext: Running Spark version 4.0.1",
    "2025-11-25T22:40:26.9116360Z 25/11/25 22:40:26 INFO SparkContext: OS info Linux, 6.8.0-1041-azure, amd64",
    "2025-11-25T22:40:26.9117549Z 25/11/25 22:40:26 INFO SparkContext: Java version 17.0.17",
    "2025-11-25T22:40:26.9117967Z 25/11/25 22:40:26 WARN NativeCodeLoader: Unable to load native-hadoop library for your platform... using builtin-java classes where applicable",
    "2025-11-25T22:40:26.9118364Z 25/11/25 22:40:26 INFO ResourceUtils: ==============================================================",
    "2025-11-25T22:40:26.9118734Z 25/11/25 22:40:26 INFO ResourceUtils: No custom resources configured for spark.driver.",
    "2025-11-25T22:40:26.9119107Z 25/11/25 22:40:26 INFO ResourceUtils: ==============================================================",
    "2025-11-25T22:40:26.9119482Z 25/11/25 22:40:26 INFO SparkContext: Submitted application: com.microsoft.azure.synapse.ml.core.test.base.TestBase$@6babf65c",
    "2025-11-25T22:40:26.9119854Z 25/11/25 22:40:26 INFO SparkContext: Spark configuration:",
    "2025-11-25T22:40:26.9120157Z spark.app.name=com.microsoft.azure.synapse.ml.core.test.base.TestBase$@6babf65c",
    "2025-11-25T22:40:26.9120435Z spark.app.startTime=1764110426436",
    "2025-11-25T22:40:26.9121459Z spark.driver.extraJavaOptions=-Djava.net.preferIPv6Addresses=false -XX:+IgnoreUnrecognizedVMOptions --add-modules=jdk.incubator.vector --add-opens=java.base/java.lang=ALL-UNNAMED --add-opens=java.base/java.lang.invoke=ALL-UNNAMED --add-opens=java.base/java.lang.reflect=ALL-UNNAMED --add-opens=java.base/java.io=ALL-UNNAMED --add-opens=java.base/java.net=ALL-UNNAMED --add-opens=java.base/java.nio=ALL-UNNAMED --add-opens=java.base/java.util=ALL-UNNAMED --add-opens=java.base/java.util.concurrent=ALL-UNNAMED --add-opens=java.base/java.util.concurrent.atomic=ALL-UNNAMED --add-opens=java.base/jdk.internal.ref=ALL-UNNAMED --add-opens=java.base/sun.nio.ch=ALL-UNNAMED --add-opens=java.base/sun.nio.cs=ALL-UNNAMED --add-opens=java.base/sun.security.action=ALL-UNNAMED --add-opens=java.base/sun.util.calendar=ALL-UNNAMED --add-opens=java.security.jgss/sun.security.krb5=ALL-UNNAMED -Djdk.reflect.useDirectMethodHandle=false -Dio.netty.tryReflectionSetAccessible=true",
    "2025-11-25T22:40:26.9122945Z spark.driver.maxResultSize=6g",
    "2025-11-25T22:40:26.9123975Z spark.executor.extraJavaOptions=-Djava.net.preferIPv6Addresses=false -XX:+IgnoreUnrecognizedVMOptions --add-modules=jdk.incubator.vector --add-opens=java.base/java.lang=ALL-UNNAMED --add-opens=java.base/java.lang.invoke=ALL-UNNAMED --add-opens=java.base/java.lang.reflect=ALL-UNNAMED --add-opens=java.base/java.io=ALL-UNNAMED --add-opens=java.base/java.net=ALL-UNNAMED --add-opens=java.base/java.nio=ALL-UNNAMED --add-opens=java.base/java.util=ALL-UNNAMED --add-opens=java.base/java.util.concurrent=ALL-UNNAMED --add-opens=java.base/java.util.concurrent.atomic=ALL-UNNAMED --add-opens=java.base/jdk.internal.ref=ALL-UNNAMED --add-opens=java.base/sun.nio.ch=ALL-UNNAMED --add-opens=java.base/sun.nio.cs=ALL-UNNAMED --add-opens=java.base/sun.security.action=ALL-UNNAMED --add-opens=java.base/sun.util.calendar=ALL-UNNAMED --add-opens=java.security.jgss/sun.security.krb5=ALL-UNNAMED -Djdk.reflect.useDirectMethodHandle=false -Dio.netty.tryReflectionSetAccessible=true",
    "2025-11-25T22:40:26.9125847Z spark.hadoop.fs.s3a.vectored.read.max.merged.size=2M",
    "2025-11-25T22:40:26.9126272Z spark.hadoop.fs.s3a.vectored.read.min.seek.size=128K",
    "2025-11-25T22:40:26.9126595Z spark.logConf=true",
    "2025-11-25T22:40:26.9126894Z spark.master=local[*]",
    "2025-11-25T22:40:26.9127220Z spark.sql.crossJoin.enabled=true",
    "2025-11-25T22:40:26.9127531Z spark.sql.shuffle.partitions=20",
    "2025-11-25T22:40:26.9127870Z spark.sql.warehouse.dir=file:/home/vsts/work/1/s/opencv/spark-warehouse",
    "2025-11-25T22:40:26.9128458Z 25/11/25 22:40:26 INFO ResourceProfile: Default ResourceProfile created, executor resources: Map(cores -> name: cores, amount: 1, script: , vendor: , memory -> name: memory, amount: 1024, script: , vendor: , offHeap -> name: offHeap, amount: 0, script: , vendor: ), task resources: Map(cpus -> name: cpus, amount: 1.0)",
    "2025-11-25T22:40:26.9129012Z 25/11/25 22:40:26 INFO ResourceProfile: Limiting resource is cpu",
    "2025-11-25T22:40:26.9129433Z 25/11/25 22:40:26 INFO ResourceProfileManager: Added ResourceProfile id: 0",
    "2025-11-25T22:40:26.9129808Z 25/11/25 22:40:26 INFO SecurityManager: Changing view acls to: vsts",
    "2025-11-25T22:40:26.9130169Z 25/11/25 22:40:26 INFO SecurityManager: Changing modify acls to: vsts",
    "2025-11-25T22:40:26.9130573Z 25/11/25 22:40:26 INFO SecurityManager: Changing view acls groups to: vsts",
    "2025-11-25T22:40:26.9130949Z 25/11/25 22:40:26 INFO SecurityManager: Changing modify acls groups to: vsts",
    "2025-11-25T22:40:26.9131472Z 25/11/25 22:40:26 INFO SecurityManager: SecurityManager: authentication disabled; ui acls disabled; users with view permissions: vsts groups with view permissions: EMPTY; users with modify permissions: vsts; groups with modify permissions: EMPTY; RPC SSL disabled",
    "2025-11-25T22:40:27.0580577Z 25/11/25 22:40:27 INFO Utils: Successfully started service 'sparkDriver' on port 44449.",
    "2025-11-25T22:40:27.0881968Z 25/11/25 22:40:27 INFO SparkEnv: Registering MapOutputTracker",
    "2025-11-25T22:40:27.1015920Z 25/11/25 22:40:27 INFO SparkEnv: Registering BlockManagerMaster",
    "2025-11-25T22:40:27.1203005Z 25/11/25 22:40:27 INFO BlockManagerMasterEndpoint: Using org.apache.spark.storage.DefaultTopologyMapper for getting topology information",
    "2025-11-25T22:40:27.1204289Z 25/11/25 22:40:27 INFO BlockManagerMasterEndpoint: BlockManagerMasterEndpoint up",
    "2025-11-25T22:40:27.1245816Z 25/11/25 22:40:27 INFO SparkEnv: Registering BlockManagerMasterHeartbeat",
    "2025-11-25T22:40:27.1485461Z 25/11/25 22:40:27 INFO DiskBlockManager: Created local directory at /tmp/blockmgr-2344e64b-2399-4a1b-bcfd-98b3f8bc0522",
    "2025-11-25T22:40:27.2004525Z 25/11/25 22:40:27 INFO SparkEnv: Registering OutputCommitCoordinator",
    "2025-11-25T22:40:27.3624195Z 25/11/25 22:40:27 INFO JettyUtils: Start Jetty 0.0.0.0:4040 for SparkUI",
    "2025-11-25T22:40:27.4388332Z 25/11/25 22:40:27 INFO Utils: Successfully started service 'SparkUI' on port 4040.",
    "2025-11-25T22:40:27.5161259Z 25/11/25 22:40:27 INFO SecurityManager: Changing view acls to: vsts",
    "2025-11-25T22:40:27.5162179Z 25/11/25 22:40:27 INFO SecurityManager: Changing modify acls to: vsts",
    "2025-11-25T22:40:27.5162544Z 25/11/25 22:40:27 INFO SecurityManager: Changing view acls groups to: vsts",
    "2025-11-25T22:40:27.5162870Z 25/11/25 22:40:27 INFO SecurityManager: Changing modify acls groups to: vsts",
    "2025-11-25T22:40:27.5176438Z 25/11/25 22:40:27 INFO SecurityManager: SecurityManager: authentication disabled; ui acls disabled; users with view permissions: vsts groups with view permissions: EMPTY; users with modify permissions: vsts; groups with modify permissions: EMPTY; RPC SSL disabled",
    "2025-11-25T22:40:27.7049156Z 25/11/25 22:40:27 INFO Executor: Starting executor ID driver on host runnervmr8kkp.gj0w5etaotquvaucz2ki3xopba.bx.internal.cloudapp.net",
    "2025-11-25T22:40:27.7111398Z 25/11/25 22:40:27 INFO Executor: OS info Linux, 6.8.0-1041-azure, amd64",
    "2025-11-25T22:40:27.7112245Z 25/11/25 22:40:27 INFO Executor: Java version 17.0.17",
    "2025-11-25T22:40:27.7370438Z 25/11/25 22:40:27 INFO Executor: Starting executor with user classpath (userClassPathFirst = false): ''",
    "2025-11-25T22:40:27.7418399Z 25/11/25 22:40:27 INFO Executor: Created or updated repl class loader org.apache.spark.util.MutableURLClassLoader@1e54ebdd for default.",
    "2025-11-25T22:40:27.7881683Z 25/11/25 22:40:27 INFO Utils: Successfully started service 'org.apache.spark.network.netty.NettyBlockTransferService' on port 39481.",
    "2025-11-25T22:40:27.8039158Z 25/11/25 22:40:27 INFO NettyBlockTransferService: Server created on runnervmr8kkp.gj0w5etaotquvaucz2ki3xopba.bx.internal.cloudapp.net:39481",
    "2025-11-25T22:40:27.8052319Z 25/11/25 22:40:27 INFO BlockManager: Using org.apache.spark.storage.RandomBlockReplicationPolicy for block replication policy",
    "2025-11-25T22:40:27.8226468Z 25/11/25 22:40:27 INFO BlockManagerMaster: Registering BlockManager BlockManagerId(driver, runnervmr8kkp.gj0w5etaotquvaucz2ki3xopba.bx.internal.cloudapp.net, 39481, None)",
    "2025-11-25T22:40:27.8270332Z 25/11/25 22:40:27 INFO BlockManagerMasterEndpoint: Registering block manager runnervmr8kkp.gj0w5etaotquvaucz2ki3xopba.bx.internal.cloudapp.net:39481 with 861.6 MiB RAM, BlockManagerId(driver, runnervmr8kkp.gj0w5etaotquvaucz2ki3xopba.bx.internal.cloudapp.net, 39481, None)",
    "2025-11-25T22:40:27.8307413Z 25/11/25 22:40:27 INFO BlockManagerMaster: Registered BlockManager BlockManagerId(driver, runnervmr8kkp.gj0w5etaotquvaucz2ki3xopba.bx.internal.cloudapp.net, 39481, None)",
    "2025-11-25T22:40:27.8311707Z 25/11/25 22:40:27 INFO BlockManager: Initialized BlockManager: BlockManagerId(driver, runnervmr8kkp.gj0w5etaotquvaucz2ki3xopba.bx.internal.cloudapp.net, 39481, None)",
    "2025-11-25T22:40:35.4268756Z [info] - Serialization Fuzzing",
    "2025-11-25T22:40:35.4500673Z [info] + Test Serialization Fuzzing took 11.418s ",
    "2025-11-25T22:40:35.4708322Z [info] - Experiment Fuzzing",
    "2025-11-25T22:40:35.4800020Z [info] + Test Experiment Fuzzing took 0.018s ",
    "2025-11-25T22:40:35.4825603Z Testing parameter height",
    "2025-11-25T22:40:35.4984046Z Testing parameter inputCol",
    "2025-11-25T22:40:35.5008971Z Testing parameter nChannels",
    "2025-11-25T22:40:35.5010239Z Testing parameter outputCol",
    "2025-11-25T22:40:35.5010753Z Testing parameter width",
    "2025-11-25T22:40:35.5028226Z [info] - Getters and Setters work as anticipated",
    "2025-11-25T22:40:35.5050813Z [info] + Test Getters and Setters work as anticipated took 0.029s ",
    "2025-11-25T22:40:36.4047853Z [info] - unroll did not change",
    "2025-11-25T22:40:36.4119529Z [info] + Test unroll did not change took 0.902s ",
    "2025-11-25T22:40:36.4138101Z Alert Provided - Suite UnrollBinaryImageSuite took 12.367s",
    "2025-11-25T22:40:36.5344233Z [info] ImageTransformerSuite:",
    "2025-11-25T22:40:37.5063363Z [info] - Serialization Fuzzing",
    "2025-11-25T22:40:37.5069468Z [info] + Test Serialization Fuzzing took 1.053s ",
    "2025-11-25T22:40:37.5461421Z [info] - Experiment Fuzzing",
    "2025-11-25T22:40:37.5514647Z [info] + Test Experiment Fuzzing took 0.039s ",
    "2025-11-25T22:40:37.5537507Z Testing parameter autoConvertToColor",
    "2025-11-25T22:40:37.5542806Z Testing parameter colorScaleFactor",
    "2025-11-25T22:40:37.5548272Z Testing parameter ignoreDecodingErrors",
    "2025-11-25T22:40:38.4219951Z Testing parameter inputCol",
    "2025-11-25T22:40:38.4221985Z Testing parameter normalizeMean",
    "2025-11-25T22:40:38.4222440Z Testing parameter normalizeStd",
    "2025-11-25T22:40:38.4222901Z Testing parameter outputCol",
    "2025-11-25T22:40:38.4223354Z Testing parameter stages",
    "2025-11-25T22:40:38.4223889Z Could not test parameter stages",
    "2025-11-25T22:40:38.4224859Z Testing parameter tensorChannelOrder",
    "2025-11-25T22:40:38.4225562Z Testing parameter tensorElementType",
    "2025-11-25T22:40:38.4225967Z Testing parameter toTensor",
    "2025-11-25T22:40:38.4226352Z [info] - Getters and Setters work as anticipated",
    "2025-11-25T22:40:38.4235990Z [info] + Test Getters and Setters work as anticipated took 0.01s ",
    "2025-11-25T22:40:38.4236711Z OpenJDK 64-Bit Server VM warning: You have loaded library /tmp/mml-natives4356202333374486111/libopencv_java320.so which might have disabled stack guard. The VM will try to fix the stack guard now.",
    "2025-11-25T22:40:38.4237614Z It's highly recommended that you fix the library with 'execstack -c <libfile>', or link it with '-z noexecstack'.",
    "2025-11-25T22:40:38.9350762Z [info] - general workflow",
    "2025-11-25T22:40:38.9355487Z [info] + Test general workflow took 1.37s ",
    "2025-11-25T22:40:39.5894087Z [info] - binary file input *** FAILED ***",
    "2025-11-25T22:40:39.5895802Z [info]   1 did not equal 31 (ImageTransformerSuite.scala:210)",
    "2025-11-25T22:40:39.6006048Z [info] + Test binary file input took 0.666s ",
    "2025-11-25T22:40:39.7795680Z [info] - binary file input 2 *** FAILED ***",
    "2025-11-25T22:40:39.7805690Z [info]   1 did not equal 31 (ImageTransformerSuite.scala:234)",
    "2025-11-25T22:40:39.7806613Z [info] + Test binary file input 2 took 0.175s ",
    "2025-11-25T22:40:39.9679420Z [info] - crop",
    "2025-11-25T22:40:39.9693680Z [info] + Test crop took 0.188s ",
    "2025-11-25T22:40:40.3597826Z [info] - color format *** FAILED ***",
    "2025-11-25T22:40:40.3638472Z [info]   java.util.NoSuchElementException: head of empty array",
    "2025-11-25T22:40:40.3639841Z [info]   at scala.collection.ArrayOps$.head$extension(ArrayOps.scala:233)",
    "2025-11-25T22:40:40.3640365Z [info]   at org.apache.spark.sql.Dataset.head(Dataset.scala:2679)",
    "2025-11-25T22:40:40.3640929Z [info]   at com.microsoft.azure.synapse.ml.opencv.OpenCVTestUtils.selectTestImageBytes(ImageTransformerSuite.scala:31)",
    "2025-11-25T22:40:40.3641509Z [info]   at com.microsoft.azure.synapse.ml.opencv.OpenCVTestUtils.selectTestImageBytes$(ImageTransformerSuite.scala:30)",
    "2025-11-25T22:40:40.3642096Z [info]   at com.microsoft.azure.synapse.ml.opencv.ImageTransformerSuite.selectTestImageBytes(ImageTransformerSuite.scala:164)",
    "2025-11-25T22:40:40.3642809Z [info]   at com.microsoft.azure.synapse.ml.opencv.ImageTransformerSuite.$anonfun$new$21(ImageTransformerSuite.scala:284)",
    "2025-11-25T22:40:40.3643348Z [info]   at scala.runtime.java8.JFunction0$mcV$sp.apply(JFunction0$mcV$sp.scala:18)",
    "2025-11-25T22:40:40.3643870Z [info]   at org.scalatest.OutcomeOf.outcomeOf(OutcomeOf.scala:85)",
    "2025-11-25T22:40:40.3644334Z [info]   at org.scalatest.OutcomeOf.outcomeOf$(OutcomeOf.scala:83)",
    "2025-11-25T22:40:40.3644814Z [info]   at org.scalatest.OutcomeOf$.outcomeOf(OutcomeOf.scala:104)",
    "2025-11-25T22:40:40.3645437Z [info]   ...",
    "2025-11-25T22:40:40.3645845Z [info] + Test color format took 0.39s ",
    "2025-11-25T22:40:40.5507116Z [info] - verify blur *** FAILED ***",
    "2025-11-25T22:40:40.5514771Z [info]   java.util.NoSuchElementException: head of empty array",
    "2025-11-25T22:40:40.5515885Z [info]   at scala.collection.ArrayOps$.head$extension(ArrayOps.scala:233)",
    "2025-11-25T22:40:40.5518015Z [info]   at org.apache.spark.sql.Dataset.head(Dataset.scala:2679)",
    "2025-11-25T22:40:40.5518461Z [info]   at com.microsoft.azure.synapse.ml.opencv.OpenCVTestUtils.selectTestImageBytes(ImageTransformerSuite.scala:31)",
    "2025-11-25T22:40:40.5518892Z [info]   at com.microsoft.azure.synapse.ml.opencv.OpenCVTestUtils.selectTestImageBytes$(ImageTransformerSuite.scala:30)",
    "2025-11-25T22:40:40.5519369Z [info]   at com.microsoft.azure.synapse.ml.opencv.ImageTransformerSuite.selectTestImageBytes(ImageTransformerSuite.scala:164)",
    "2025-11-25T22:40:40.5519809Z [info]   at com.microsoft.azure.synapse.ml.opencv.ImageTransformerSuite.$anonfun$new$23(ImageTransformerSuite.scala:303)",
    "2025-11-25T22:40:40.5520192Z [info]   at scala.runtime.java8.JFunction0$mcV$sp.apply(JFunction0$mcV$sp.scala:18)",
    "2025-11-25T22:40:40.5520547Z [info]   at org.scalatest.OutcomeOf.outcomeOf(OutcomeOf.scala:85)",
    "2025-11-25T22:40:40.5520864Z [info]   at org.scalatest.OutcomeOf.outcomeOf$(OutcomeOf.scala:83)",
    "2025-11-25T22:40:40.5521182Z [info]   at org.scalatest.OutcomeOf$.outcomeOf(OutcomeOf.scala:104)",
    "2025-11-25T22:40:40.5521464Z [info]   ...",
    "2025-11-25T22:40:40.5521691Z [info] + Test verify blur took 0.182s ",
    "2025-11-25T22:40:41.0377324Z [info] - verify thresholding",
    "2025-11-25T22:40:41.0388669Z [info] + Test verify thresholding took 0.492s ",
    "2025-11-25T22:40:41.2180803Z [info] - verify application of gaussian kernel (has blur effect) *** FAILED ***",
    "2025-11-25T22:40:41.2183072Z [info]   java.util.NoSuchElementException: head of empty array",
    "2025-11-25T22:40:41.2184404Z [info]   at scala.collection.ArrayOps$.head$extension(ArrayOps.scala:233)",
    "2025-11-25T22:40:41.2185860Z [info]   at org.apache.spark.sql.Dataset.head(Dataset.scala:2679)",
    "2025-11-25T22:40:41.2187374Z [info]   at com.microsoft.azure.synapse.ml.opencv.OpenCVTestUtils.selectTestImageBytes(ImageTransformerSuite.scala:31)",
    "2025-11-25T22:40:41.2207876Z [info]   at com.microsoft.azure.synapse.ml.opencv.OpenCVTestUtils.selectTestImageBytes$(ImageTransformerSuite.scala:30)",
    "2025-11-25T22:40:41.2208482Z [info]   at com.microsoft.azure.synapse.ml.opencv.ImageTransformerSuite.selectTestImageBytes(ImageTransformerSuite.scala:164)",
    "2025-11-25T22:40:41.2226145Z [info]   at com.microsoft.azure.synapse.ml.opencv.ImageTransformerSuite.$anonfun$new$28(ImageTransformerSuite.scala:341)",
    "2025-11-25T22:40:41.2226911Z [info]   at scala.runtime.java8.JFunction0$mcV$sp.apply(JFunction0$mcV$sp.scala:18)",
    "2025-11-25T22:40:41.2227288Z [info]   at org.scalatest.OutcomeOf.outcomeOf(OutcomeOf.scala:85)",
    "2025-11-25T22:40:41.2227639Z [info]   at org.scalatest.OutcomeOf.outcomeOf$(OutcomeOf.scala:83)",
    "2025-11-25T22:40:41.2227962Z [info]   at org.scalatest.OutcomeOf$.outcomeOf(OutcomeOf.scala:104)",
    "2025-11-25T22:40:41.2228222Z [info]   ...",
    "2025-11-25T22:40:41.2228514Z [info] + Test verify application of gaussian kernel (has blur effect) took 0.175s ",
    "2025-11-25T22:40:41.8389119Z [info] - verify ignore decoding error *** FAILED ***",
    "2025-11-25T22:40:41.8392860Z [info]   1 did not equal 0 (ImageTransformerSuite.scala:359)",
    "2025-11-25T22:40:41.8395766Z [info] + Test verify ignore decoding error took 0.622s ",
    "2025-11-25T22:40:42.6553431Z [info] - image transformer can convert a 3-channel image to tensor",
    "2025-11-25T22:40:42.6563151Z [info] + Test image transformer can convert a 3-channel image to tensor took 0.817s ",
    "2025-11-25T22:40:43.1377119Z [info] - image transformer can convert a 4-channel image to tensor",
    "2025-11-25T22:40:43.1378780Z [info] + Test image transformer can convert a 4-channel image to tensor took 0.475s ",
    "2025-11-25T22:40:43.4705926Z [info] - image transformer can convert a single-channel (grayscale) image to tensor",
    "2025-11-25T22:40:43.4726038Z [info] + Test image transformer can convert a single-channel (grayscale) image to tensor took 0.337s ",
    "2025-11-25T22:40:43.4726824Z Info Provided - Suite ImageTransformerSuite took 6.991s",
    "2025-11-25T22:40:43.5149191Z [info] ImageSetAugmenterSuite:",
    "2025-11-25T22:40:48.6030362Z [info] - Serialization Fuzzing",
    "2025-11-25T22:40:48.6031516Z [info] + Test Serialization Fuzzing took 5.109s ",
    "2025-11-25T22:40:48.6478369Z [info] - Experiment Fuzzing",
    "2025-11-25T22:40:48.6504992Z [info] + Test Experiment Fuzzing took 0.049s ",
    "2025-11-25T22:40:48.6548586Z Testing parameter flipLeftRight",
    "2025-11-25T22:40:48.6549206Z Testing parameter flipUpDown",
    "2025-11-25T22:40:48.6549991Z Testing parameter inputCol",
    "2025-11-25T22:40:48.6550523Z Testing parameter outputCol",
    "2025-11-25T22:40:48.6563473Z [info] - Getters and Setters work as anticipated",
    "2025-11-25T22:40:48.6591004Z [info] + Test Getters and Setters work as anticipated took 0.005s ",
    "2025-11-25T22:40:49.9308708Z Info Provided - Suite ImageSetAugmenterSuite took 5.816s",
    "2025-11-25T22:40:49.9310788Z [info] - An augmenter should be abe to flip images",
    "2025-11-25T22:40:50.9322994Z [info] + Test An augmenter should be abe to flip images took 0.653s ",
    "2025-11-25T22:40:50.9358245Z [info] UnrollImageSuite:",
    "2025-11-25T22:40:50.9359037Z [info] - Serialization Fuzzing",
    "2025-11-25T22:40:50.9359411Z [info] + Test Serialization Fuzzing took 1.171s ",
    "2025-11-25T22:40:50.9359839Z [info] - Experiment Fuzzing",
    "2025-11-25T22:40:50.9360200Z [info] + Test Experiment Fuzzing took 0.01s ",
    "2025-11-25T22:40:50.9360622Z [info] - Getters and Setters work as anticipated",
    "2025-11-25T22:40:50.9360992Z [info] + Test Getters and Setters work as anticipated took 0.002s ",
    "2025-11-25T22:40:50.9361341Z Testing parameter inputCol",
    "2025-11-25T22:40:50.9362025Z Testing parameter outputCol",
    "2025-11-25T22:40:50.9362346Z [info] - roll and unroll",
    "2025-11-25T22:40:50.9362699Z [info] + Test roll and unroll took 0.15s ",
    "2025-11-25T22:40:50.9841499Z [info] - unroll",
    "2025-11-25T22:40:50.9866911Z Info Provided - Suite UnrollImageSuite took 1.655s",
    "2025-11-25T22:40:50.9886038Z [info] + Test unroll took 0.322s ",
    "2025-11-25T22:40:51.2050158Z [info] Passed: Total 0, Failed 0, Errors 0, Passed 0",
    "2025-11-25T22:40:51.2052910Z [info] No tests to run for Test / testOnly",
    "2025-11-25T22:40:51.2092055Z [info] Run completed in 28 seconds, 748 milliseconds.",
    "2025-11-25T22:40:51.2117120Z [info] Total number of tests run: 28",
    "2025-11-25T22:40:51.2117683Z [info] Suites: completed 4, aborted 0",
    "2025-11-25T22:40:51.2118083Z [info] Tests: succeeded 22, failed 6, canceled 0, ignored 0, pending 0",
    "2025-11-25T22:40:51.2118440Z [info] *** 6 TESTS FAILED ***",
    "2025-11-25T22:40:51.2126710Z [error] Failed tests:",
    "2025-11-25T22:40:51.2129890Z [error] \tcom.microsoft.azure.synapse.ml.opencv.ImageTransformerSuite",
    "2025-11-25T22:40:51.2149699Z [info] Passed: Total 0, Failed 0, Errors 0, Passed 0",
    "2025-11-25T22:40:51.2150414Z [info] No tests to run for deepLearning / Test / testOnly",
    "2025-11-25T22:40:51.2775193Z [error] (opencv / Test / testOnly) sbt.TestsFailedException: Tests unsuccessful",
    "2025-11-25T22:40:51.2862083Z [error] Total time: 37 s, completed Nov 25, 2025, 10:40:51 PM",
    "2025-11-25T22:40:51.6789686Z ",
    "2025-11-25T22:40:51.6811970Z ##[error]Script failed with exit code: 1",
    "2025-11-25T22:40:51.6815661Z [command]/opt/hostedtoolcache/Python/3.8.18/x64/bin/az account clear",
    "2025-11-25T22:40:52.2770867Z ##[section]Finishing: Unit Test"
  ]
}
